{
  "$id": "http://example.com/config.json",
  "$schema": "http://json-schema.org/draft-07/schema#",
  "type": "object",
  "properties": {
    "session": {
      "type": "string"
    },
    "modules": {
      "type": "array",
      "items": {
        "type": "string"
      }
    },
    "clients": {
      "type": "array",
      "items": {
        "type": "object",
        "properties": {
          "name": {
            "type": "string"
          },
          "pkg": {
            "type": "string"
          },
          "options": {
            "type": "object"
          }
        },
        "required": ["name", "pkg"]
      }
    },
    "reporters": {
      "type": "array",
      "items": {
        "type": "object",
        "properties": {
          "name": {
            "type": "string"
          },
          "pkg": {
            "type": "string"
          },
          "options": {
            "type": "object"
          }
        },
        "required": ["name", "pkg"]
      }
    },
    "plugins": {
      "type": "array",
      "items": {
        "type": "object",
        "properties": {
          "pkg": {
            "type": "string"
          },
          "options": {
            "type": "object"
          }
        },
        "required": ["pkg"]
      }
    },
    "defines": {
      "$ref": "defines.json"
    }
  },
  "required": ["modules"]
}
